[
  {
    "source": "okta",
    "event_type": "okta_user_mfa",
    "resource_type": "user",
    "resource_id": "okta://00uEXAMPLE0000000001",
    "collected_at": "2026-04-17T14:02:11Z",
    "control_hints": [
      {"framework": "soc-2", "control_id": "CC6.1"},
      {"framework": "iso-27001", "control_id": "A.8.5"},
      {"framework": "nist-800-53", "control_id": "IA-2"}
    ],
    "payload": {
      "user_id": "00uEXAMPLE0000000001",
      "login": "jane@example.com",
      "status": "ACTIVE",
      "mfa_factor_count": 2,
      "mfa_factor_types": ["push", "webauthn"],
      "mfa_provider_types": ["FIDO", "OKTA"]
    }
  },
  {
    "source": "okta",
    "event_type": "okta_user_mfa",
    "resource_type": "user",
    "resource_id": "okta://00uEXAMPLE0000000002",
    "collected_at": "2026-04-17T14:02:11Z",
    "control_hints": [
      {"framework": "soc-2", "control_id": "CC6.1"},
      {"framework": "iso-27001", "control_id": "A.8.5"},
      {"framework": "nist-800-53", "control_id": "IA-2"}
    ],
    "payload": {
      "user_id": "00uEXAMPLE0000000002",
      "login": "contractor@example.com",
      "status": "ACTIVE",
      "mfa_factor_count": 0,
      "mfa_factor_types": [],
      "mfa_provider_types": []
    }
  },
  {
    "source": "okta",
    "event_type": "okta_privileged_group_membership",
    "resource_type": "group_membership",
    "resource_id": "okta://group/00gEXAMPLE0000000010/user/00uEXAMPLE0000000001",
    "collected_at": "2026-04-17T14:02:11Z",
    "control_hints": [
      {"framework": "soc-2", "control_id": "CC6.2"},
      {"framework": "iso-27001", "control_id": "A.5.18"},
      {"framework": "nist-800-53", "control_id": "AC-6"}
    ],
    "payload": {
      "group_id": "00gEXAMPLE0000000010",
      "group_name": "engineering-admins",
      "user_id": "00uEXAMPLE0000000001",
      "login": "jane@example.com",
      "status": "ACTIVE"
    }
  }
]
